{
  "$schema": "../../../schemas/learning-proposal.schema.json",
  "schema_version": "1.0.0",
  "proposal_id": "gemini-arbitrage-family-001",
  "proposing_environment": "normsexchange-dev",
  "proposing_agent": "STOVE2_FRONTEND",
  "target_scope": "rejected_or_unverified",
  "target_family": null,
  "observation": "The source proposes a distinct federated arbitrage family with bilateral contract generation and matching behavior.",
  "evidence_references": [
    {"source_kind": "immutable_public_git", "path": "DURABLE_KNOWLEDGE.md", "sha256_lf": "b71bdb9f09c468214ad42552743e45ee4bebe59b165e1cdd10ddf2af132604a0"},
    {"source_kind": "immutable_public_git", "path": "server.ts", "sha256_lf": "5e2603aa53acf04413ab18ca23ba5a94bd8719451af2804eb83bea976e00c6ef"}
  ],
  "provenance_classification": "hypothesis",
  "confidence": 0.4,
  "known_counterexamples": ["The implementation generates terms and relies on inferred contacts without a complete evidence and authority package."],
  "conflict_analysis": "The purpose is distinct from WTB research and cannot enter that base family. A future family might be valid, but the snapshot lacks a complete vendor-neutral package, contract boundaries, provenance model, and adverse evaluations.",
  "privacy_review": "pass",
  "credential_review": "pass",
  "proposed_wording": "Defer the proposed family until a sovereign publisher provides a complete purpose, nonpurpose, procedures, evidence model, boundaries, contracts, fictional fixtures, and adverse evaluations.",
  "affected_playbook_sections": [],
  "proposed_evaluation_changes": ["Reject creation of a family from a name and application capability alone."],
  "disposition": "deferred",
  "adopting_authority": null,
  "release_containing_lesson": null,
  "foreign_source": {
    "environment_id": "gemini-sandbox-legacy",
    "publisher_owner": "normsexchange-gemini",
    "repository": "normsexchange-gemini/nx-gemini-communications_dev",
    "repository_id": "1346945284",
    "visibility": "public",
    "commit": "857111e7c39b355e3a7f6f999c6997a5449424d7",
    "tree": "58f01277d3ef07ae052ba1d49c69d58dffb2e809",
    "tag": "snapshot-post-alignment",
    "tag_object": "98db76569ee59266f0d9e914cb06280041e7fa02",
    "tag_target": "857111e7c39b355e3a7f6f999c6997a5449424d7",
    "source_paths": ["DURABLE_KNOWLEDGE.md", "server.ts"]
  },
  "source_review": {
    "original_publisher": "normsexchange-gemini",
    "source_classification": "incomplete family hypothesis",
    "first_known_at": "2026-08-29T01:07:22Z",
    "last_reviewed_at": "2026-08-29T02:00:00Z",
    "privacy_classification": "sanitized purpose claim only",
    "source_credential_review": "unknown",
    "synthetic_or_simulated_status": "mixed",
    "independently_validated": false,
    "adverse_evaluations": ["incomplete-foreign-family-not-created"],
    "compatibility_impact": "deferred",
    "broader_scope_limitations": "The distinct purpose cannot be placed in wtb-researcher, and evidence is insufficient to publish a new family or specialization."
  }
}
