{
  "$schema": "../../../schemas/learning-proposal.schema.json",
  "schema_version": "1.0.0",
  "proposal_id": "gemini-persistent-store-001",
  "proposing_environment": "normsexchange-dev",
  "proposing_agent": "STOVE2_FRONTEND",
  "target_scope": "instance_memory",
  "target_family": "wtb-researcher",
  "observation": "The source describes and implements a persistent JSON application store and caches.",
  "evidence_references": [
    {"source_kind": "immutable_public_git", "path": "DURABLE_KNOWLEDGE.md", "sha256_lf": "b71bdb9f09c468214ad42552743e45ee4bebe59b165e1cdd10ddf2af132604a0"},
    {"source_kind": "immutable_public_git", "path": "server/database.ts", "sha256_lf": "bca0a335280a7fa8c0a6c856c71d5955095ea640c16b2e7dabead6410225d8a8"}
  ],
  "provenance_classification": "example",
  "confidence": 0.9,
  "known_counterexamples": ["A family can operate with a different sovereign storage architecture or no persistent store."],
  "conflict_analysis": "The architecture is compatible with internal autonomy but is not family knowledge and says nothing about data quality or admission.",
  "privacy_review": "pass",
  "credential_review": "pass",
  "proposed_wording": "Retain the storage choice only as source-instance architecture; do not import records, caches, paths, or implementation into a base family.",
  "affected_playbook_sections": [],
  "proposed_evaluation_changes": ["Reject silent promotion of a foreign persistence implementation into family knowledge."],
  "disposition": "deferred",
  "adopting_authority": null,
  "release_containing_lesson": null,
  "foreign_source": {
    "environment_id": "gemini-sandbox-legacy",
    "publisher_owner": "normsexchange-gemini",
    "repository": "normsexchange-gemini/nx-gemini-communications_dev",
    "repository_id": "1346945284",
    "visibility": "public",
    "commit": "857111e7c39b355e3a7f6f999c6997a5449424d7",
    "tree": "58f01277d3ef07ae052ba1d49c69d58dffb2e809",
    "tag": "snapshot-post-alignment",
    "tag_object": "98db76569ee59266f0d9e914cb06280041e7fa02",
    "tag_target": "857111e7c39b355e3a7f6f999c6997a5449424d7",
    "source_paths": ["DURABLE_KNOWLEDGE.md", "server/database.ts"]
  },
  "source_review": {
    "original_publisher": "normsexchange-gemini",
    "source_classification": "instance architecture",
    "first_known_at": "2026-08-29T01:07:22Z",
    "last_reviewed_at": "2026-08-29T02:00:00Z",
    "privacy_classification": "architecture description only",
    "source_credential_review": "unknown",
    "synthetic_or_simulated_status": "mixed",
    "independently_validated": true,
    "adverse_evaluations": ["foreign-instance-architecture-not-family"],
    "compatibility_impact": "deferred",
    "broader_scope_limitations": "The storage design is runtime-specific instance architecture and does not establish reusable family behavior."
  }
}
